{
  "$schema": "https://json-schema.org/draft/2020-12/schema",
  "$id": "urn:dev-team:plan",
  "title": "plans/<切片id>.json — 编码计划：这次要动哪些代码文件、按什么顺序、每步守什么",
  "type": "object",
  "additionalProperties": false,
  "required": [
    "slice",
    "kind",
    "role",
    "builtAt",
    "codebase",
    "scope",
    "steps",
    "confirmedAt",
    "log"
  ],
  "properties": {
    "slice": {
      "type": "string",
      "pattern": "^s-[0-9]{3,}$"
    },
    "kind": {
      "enum": [
        "proto",
        "shell",
        "full"
      ],
      "description": "proto：段落切片的原型（领域 + 应用 + 内存适配器），只在应用遍算——骨架遍与行为遍不写代码、不进计划（第九十五批）；shell：实现切片的生产外壳；full：老式切片，两者都有"
    },
    "role": {
      "enum": [
        "原型",
        "编码"
      ],
      "description": "谁按这份计划写"
    },
    "builtAt": {
      "type": "string"
    },
    "codebase": {
      "type": "string",
      "description": "代码库，相对项目目录"
    },
    "scope": {
      "type": "object",
      "additionalProperties": false,
      "required": [
        "modules",
        "aggregates",
        "useCases"
      ],
      "properties": {
        "modules": {
          "type": "array",
          "items": {
            "$ref": "urn:dev-team:common#/$defs/modelName"
          }
        },
        "aggregates": {
          "type": "array",
          "items": {
            "$ref": "urn:dev-team:common#/$defs/qualifiedName"
          },
          "description": "按依赖顺序（被 idRef 指向的先）"
        },
        "useCases": {
          "type": "array",
          "items": {
            "$ref": "urn:dev-team:common#/$defs/qualifiedName"
          }
        }
      }
    },
    "steps": {
      "type": "array",
      "items": {
        "type": "object",
        "additionalProperties": false,
        "required": [
          "n",
          "layer",
          "action",
          "file",
          "target",
          "what",
          "traces",
          "needsKeyLogic",
          "keyLogic",
          "doneAt"
        ],
        "properties": {
          "n": {
            "type": "integer",
            "minimum": 1
          },
          "layer": {
            "enum": [
              "building-block",
              "domain",
              "repository",
              "service",
              "application",
              "port",
              "adapter",
              "shell",
              "composition",
              "proto",
              "test",
              "input"
            ]
          },
          "action": {
            "enum": [
              "create",
              "modify"
            ]
          },
          "file": {
            "type": [
              "string",
              "null"
            ],
            "description": "相对代码库；文件名可含 *；null = 位置由技术选型定，或不是代码库里的文件（故事输入）"
          },
          "target": {
            "type": "string",
            "minLength": 1,
            "description": "模型元素的限定名，或 Module.module / proto.main / <切片>.story"
          },
          "what": {
            "type": "string",
            "minLength": 1,
            "description": "机器从模型算出来的：这一步建什么、含哪些行为 / 步骤"
          },
          "traces": {
            "$ref": "urn:dev-team:common#/$defs/traces"
          },
          "needsKeyLogic": {
            "type": "boolean",
            "description": "这一步有业务判断（行为、规则、分流、事务、锁、状态码），角色必须补关键逻辑"
          },
          "keyLogic": {
            "type": [
              "string",
              "null"
            ],
            "description": "角色填：这一步守哪条规则、哪条不变量在这里生效、分流怎么走；外壳步骤写事务边界、锁、错误 → 状态码"
          },
          "doneAt": {
            "type": [
              "string",
              "null"
            ],
            "description": "角色完成这一步的时间（plan done）；核对顺序用"
          },
          "noFile": {
            "type": "string",
            "description": "这一步用现成的东西（构建块里已有的）结掉，不另建文件；写清楚用的是哪个、为什么不另建。plan done --已有 <说明> 写上，核对时照它放行、并单独列一行"
          },
          "contract": {
            "type": [
              "string",
              "null"
            ],
            "description": "外壳步骤：对应的契约文件（contracts/…）"
          },
          "confirmedAt": {
            "type": [
              "string",
              "null"
            ],
            "description": "人确认了这一步的关键逻辑（分步确认）；全部步骤都确认了 plan.confirmedAt 才有值"
          },
          "confirmedKeyLogic": {
            "type": [
              "string",
              "null"
            ],
            "description": "人确认那一刻这一步的关键逻辑原文。此后 keyLogic 与它对不上，说明角色事后改过文字，这一步的确认不算数（plan check 报、plan done 拦、计划页请人重看）"
          },
          "humanNotes": {
            "type": "array",
            "description": "人在这一步上留的话（计划页「有话说」或 plan comment）：哪里不对、要改成什么；写码角色开写前读",
            "items": {
              "type": "object",
              "required": [
                "ts",
                "text"
              ],
              "properties": {
                "ts": {
                  "type": "string"
                },
                "text": {
                  "type": "string",
                  "minLength": 1
                }
              }
            }
          }
        }
      }
    },
    "already": {
      "type": "array",
      "description": "别的切片已经做过、代码还在、跟现在的模型仍然一致的那些项：不列进 steps，只记在这里给人看。模型改了、代码没跟上的，下次算计划会自动回到 steps 里",
      "items": {
        "type": "object",
        "additionalProperties": false,
        "required": [
          "layer",
          "file",
          "target",
          "what",
          "by"
        ],
        "properties": {
          "layer": {
            "enum": [
              "building-block",
              "domain",
              "repository",
              "service",
              "application",
              "port",
              "adapter",
              "shell",
              "composition",
              "proto",
              "test",
              "input"
            ]
          },
          "file": {
            "type": [
              "string",
              "null"
            ]
          },
          "target": {
            "type": "string",
            "minLength": 1
          },
          "what": {
            "type": "string",
            "minLength": 1
          },
          "by": {
            "type": "object",
            "additionalProperties": false,
            "required": [
              "slice",
              "n"
            ],
            "properties": {
              "slice": {
                "type": "string",
                "pattern": "^s-[0-9]{3,}$",
                "description": "哪一条切片的施工单做的"
              },
              "n": {
                "type": "integer",
                "minimum": 1,
                "description": "那张单子上的第几步"
              },
              "noFile": {
                "type": "string",
                "description": "当初就是按「用现成的、不另建文件」结掉的，理由照抄过来"
              }
            }
          }
        }
      }
    },
    "modelFingerprint": {
      "type": [
        "string",
        "null"
      ],
      "description": "算这份计划时模型的样子（不含 decisions 与 questions）。核对时再算一次，对不上就说明模型之后又改过，这份单子不作数，要 plan build --force 重算"
    },
    "confirmedAt": {
      "type": [
        "string",
        "null"
      ],
      "pattern": "^[0-9]{4}-[0-9]{2}-[0-9]{2}",
      "description": "人确认计划的日期；确认前不开写"
    },
    "amendedAt": {
      "type": [
        "string",
        "null"
      ],
      "pattern": "^[0-9]{4}-[0-9]{2}-[0-9]{2}",
      "description": "确认之后按 plan amend 核对过、只换了模型指纹的日期；要动的文件与顺序一件没变才准这么做，理由记在 log 里"
    },
    "log": {
      "type": "array",
      "items": {
        "type": "string"
      }
    }
  }
}
