{
  "slice": "s-001",
  "kind": "full",
  "role": "编码",
  "builtAt": "2026-09-07T01:37:54.439Z",
  "codebase": "../order-code",
  "scope": {
    "modules": [
      "Ordering"
    ],
    "aggregates": [
      "Ordering.Order"
    ],
    "useCases": [
      "Ordering.ChargeCustomerOnOrderConfirmed",
      "Ordering.CreateOrder",
      "Ordering.GetOrder",
      "Ordering.NotifySupplierOnOrderConfirmed"
    ]
  },
  "steps": [
    {
      "n": 1,
      "layer": "domain",
      "action": "modify",
      "file": "src/Ordering/domain/order/value-object.MoneyValueObject.ts",
      "target": "Ordering.Money",
      "what": "值对象 Money：行为 add、times；不变量 1 条",
      "traces": [
        "R-004"
      ],
      "needsKeyLogic": true,
      "keyLogic": "[R-004] CREATE 拒绝负数（InvalidMoney）；add 先比币种，不同即抛 CurrencyMismatch，再相加返回新实例；times 复用 CREATE 让结果也过守卫",
      "doneAt": "2026-09-07T01:42:52.935Z"
    },
    {
      "n": 2,
      "layer": "domain",
      "action": "modify",
      "file": "src/Ordering/domain/order/entity.OrderLineEntity.ts",
      "target": "Ordering.OrderLine",
      "what": "实体 OrderLine：行为 subtotal；不变量 1 条",
      "traces": [
        "G-001",
        "R-002"
      ],
      "needsKeyLogic": true,
      "keyLogic": "[R-002] CREATE 拒绝非正整数数量（InvalidOrderLine）；[R-003] subtotal = unitPrice.times(quantity)，不在这里算折扣",
      "doneAt": "2026-09-07T01:42:53.328Z"
    },
    {
      "n": 3,
      "layer": "domain",
      "action": "modify",
      "file": "src/Ordering/domain/order/event.OrderConfirmedEvent.ts",
      "target": "Ordering.OrderConfirmed",
      "what": "事件 OrderConfirmed（orderId, customerId, total）",
      "traces": [
        "G-004"
      ],
      "needsKeyLogic": false,
      "keyLogic": null,
      "doneAt": "2026-09-07T01:42:53.735Z"
    },
    {
      "n": 4,
      "layer": "domain",
      "action": "modify",
      "file": "src/Ordering/domain/order/event.OrderRejectedEvent.ts",
      "target": "Ordering.OrderRejected",
      "what": "事件 OrderRejected（orderId, reason）",
      "traces": [
        "G-004"
      ],
      "needsKeyLogic": false,
      "keyLogic": null,
      "doneAt": "2026-09-07T01:42:54.134Z"
    },
    {
      "n": 5,
      "layer": "domain",
      "action": "modify",
      "file": "src/Ordering/domain/order/error.CurrencyMismatchError.ts",
      "target": "Ordering.CurrencyMismatch",
      "what": "错误 CurrencyMismatch：两个不同币种的金额相加",
      "traces": [
        "R-004"
      ],
      "needsKeyLogic": false,
      "keyLogic": null,
      "doneAt": "2026-09-07T01:42:54.538Z"
    },
    {
      "n": 6,
      "layer": "domain",
      "action": "modify",
      "file": "src/Ordering/domain/order/error.InvalidMoneyError.ts",
      "target": "Ordering.InvalidMoney",
      "what": "错误 InvalidMoney：金额为负",
      "traces": [
        "R-004"
      ],
      "needsKeyLogic": false,
      "keyLogic": null,
      "doneAt": "2026-09-07T01:42:54.950Z"
    },
    {
      "n": 7,
      "layer": "domain",
      "action": "modify",
      "file": "src/Ordering/domain/order/error.InvalidOrderLineError.ts",
      "target": "Ordering.InvalidOrderLine",
      "what": "错误 InvalidOrderLine：订单行的数量不是正整数",
      "traces": [
        "R-002"
      ],
      "needsKeyLogic": false,
      "keyLogic": null,
      "doneAt": "2026-09-07T01:42:55.359Z"
    },
    {
      "n": 8,
      "layer": "domain",
      "action": "modify",
      "file": "src/Ordering/domain/order/error.OrderFailedError.ts",
      "target": "Ordering.OrderFailed",
      "what": "错误 OrderFailed：订单不在草稿状态时尝试修改、打折或确认",
      "traces": [
        "R-001"
      ],
      "needsKeyLogic": false,
      "keyLogic": null,
      "doneAt": "2026-09-07T01:42:55.820Z"
    },
    {
      "n": 9,
      "layer": "domain",
      "action": "modify",
      "file": "src/Ordering/domain/order/aggregate-root.OrderAggregateRoot.ts",
      "target": "Ordering.Order",
      "what": "聚合根 Order：行为 addLine、applyDiscount、confirm、total；不变量 2 条",
      "traces": [
        "G-001",
        "G-004",
        "R-001",
        "R-005",
        "U-001",
        "R-003"
      ],
      "needsKeyLogic": true,
      "keyLogic": "[R-001][U-001] addLine / applyDiscount / confirm 三个行为都先看 status 是不是 draft，不是就抛 OrderFailed——连点两次确认第二次在这里被挡；[G-004] confirm 时没有行 → 状态 rejected 并 raise OrderRejected，有行 → confirmed 并 raise OrderConfirmed（带 total）；[R-005] applyDiscount 拒绝 >50 或 <0；[R-003] total = 各行小计求和再乘 (100 - discountPercent)/100",
      "doneAt": "2026-09-07T01:42:56.326Z"
    },
    {
      "n": 10,
      "layer": "repository",
      "action": "modify",
      "file": "src/Ordering/domain/order/repository.OrderRepositoryInterface.ts",
      "target": "Ordering.OrderRepository",
      "what": "仓储接口 OrderRepository：findById(读)、save(写)",
      "traces": [],
      "needsKeyLogic": false,
      "keyLogic": null,
      "doneAt": "2026-09-07T01:42:56.684Z"
    },
    {
      "n": 11,
      "layer": "application",
      "action": "modify",
      "file": "src/Ordering/application/command-handler.CreateOrderCommandHandler.ts",
      "target": "Ordering.CreateOrder",
      "what": "命令 CreateOrder：确认客户存在 → 创建订单 → 保存订单；写 Order",
      "traces": [
        "G-001"
      ],
      "needsKeyLogic": true,
      "keyLogic": "[G-001] 三步直线：客户不存在用 assertFound 挡（技术守卫，不是业务 if）→ Order.CREATE 建草稿 → save → publish；处理器里没有任何判断",
      "doneAt": "2026-09-07T01:42:57.080Z"
    },
    {
      "n": 12,
      "layer": "application",
      "action": "modify",
      "file": "src/Ordering/application/query-handler.GetOrderQueryHandler.ts",
      "target": "Ordering.GetOrder",
      "what": "查询 GetOrder：读取订单",
      "traces": [
        "G-002"
      ],
      "needsKeyLogic": true,
      "keyLogic": "[G-002] 只读：findById → assertFound → 组装 Result(status, lineCount)；不调任何写方法",
      "doneAt": "2026-09-07T01:42:57.465Z"
    },
    {
      "n": 13,
      "layer": "application",
      "action": "modify",
      "file": "src/Ordering/application/event-handler.ChargeCustomerOnOrderConfirmedEventHandler.ts",
      "target": "Ordering.ChargeCustomerOnOrderConfirmed",
      "what": "事件处理 ChargeCustomerOnOrderConfirmed：触发 OrderConfirmed；通过支付网关收款",
      "traces": [
        "R-007"
      ],
      "needsKeyLogic": true,
      "keyLogic": "[R-007] 事件 payload 里已经带 total 与 customerId，处理器只把它们交给 PaymentGateway.charge；金额不在这里算",
      "doneAt": "2026-09-07T01:42:57.871Z"
    },
    {
      "n": 14,
      "layer": "application",
      "action": "modify",
      "file": "src/Ordering/application/event-handler.NotifySupplierOnOrderConfirmedEventHandler.ts",
      "target": "Ordering.NotifySupplierOnOrderConfirmed",
      "what": "事件处理 NotifySupplierOnOrderConfirmed：触发 OrderConfirmed；通知供应商备货",
      "traces": [
        "R-006"
      ],
      "needsKeyLogic": true,
      "keyLogic": "[R-006] 只把 orderId 交给 SupplierNotification.notify；不查订单、不判断状态（事件已经保证是确认后的订单）",
      "doneAt": "2026-09-07T01:42:58.400Z"
    },
    {
      "n": 15,
      "layer": "port",
      "action": "modify",
      "file": "src/Ordering/ports/port.CustomerLookupInterface.ts",
      "target": "Ordering.CustomerLookup",
      "what": "端口 CustomerLookup（模块 Customers）：findById",
      "traces": [
        "G-001"
      ],
      "needsKeyLogic": false,
      "keyLogic": null,
      "doneAt": "2026-09-07T01:42:58.873Z"
    },
    {
      "n": 16,
      "layer": "port",
      "action": "modify",
      "file": "src/Ordering/ports/port.PaymentGatewayInterface.ts",
      "target": "Ordering.PaymentGateway",
      "what": "端口 PaymentGateway（外部系统 Stripe）：charge",
      "traces": [
        "R-007"
      ],
      "needsKeyLogic": false,
      "keyLogic": null,
      "doneAt": "2026-09-07T01:42:59.496Z"
    },
    {
      "n": 17,
      "layer": "port",
      "action": "modify",
      "file": "src/Ordering/ports/port.SupplierNotificationInterface.ts",
      "target": "Ordering.SupplierNotification",
      "what": "端口 SupplierNotification（外部系统 SupplierPortal）：notify",
      "traces": [
        "R-006"
      ],
      "needsKeyLogic": false,
      "keyLogic": null,
      "doneAt": "2026-09-07T01:43:00.409Z"
    },
    {
      "n": 18,
      "layer": "adapter",
      "action": "modify",
      "file": "src/Ordering/adapters/adapter.*OrderRepository.ts",
      "target": "Ordering.OrderRepository",
      "what": "仓储适配器：实现 OrderRepositoryInterface；save 带乐观锁；不分发事件",
      "traces": [],
      "needsKeyLogic": false,
      "keyLogic": null,
      "doneAt": "2026-09-07T01:43:00.981Z"
    },
    {
      "n": 19,
      "layer": "adapter",
      "action": "modify",
      "file": "src/Ordering/adapters/adapter.*CustomerLookup.ts",
      "target": "Ordering.CustomerLookup",
      "what": "适配器：实现 CustomerLookupInterface（Customers）；只做线格式转换，不含判断",
      "traces": [],
      "needsKeyLogic": false,
      "keyLogic": null,
      "doneAt": "2026-09-07T01:43:01.548Z"
    },
    {
      "n": 20,
      "layer": "adapter",
      "action": "modify",
      "file": "src/Ordering/adapters/adapter.*PaymentGateway.ts",
      "target": "Ordering.PaymentGateway",
      "what": "适配器：实现 PaymentGatewayInterface（Stripe）；只做线格式转换，不含判断",
      "traces": [],
      "needsKeyLogic": false,
      "keyLogic": null,
      "doneAt": "2026-09-07T01:43:02.109Z"
    },
    {
      "n": 21,
      "layer": "adapter",
      "action": "modify",
      "file": "src/Ordering/adapters/adapter.*SupplierNotification.ts",
      "target": "Ordering.SupplierNotification",
      "what": "适配器：实现 SupplierNotificationInterface（SupplierPortal）；只做线格式转换，不含判断",
      "traces": [],
      "needsKeyLogic": false,
      "keyLogic": null,
      "doneAt": "2026-09-07T01:43:02.419Z"
    },
    {
      "n": 22,
      "layer": "adapter",
      "action": "modify",
      "file": "src/*/adapters/adapter.*EventPublisher.ts",
      "target": "shared.EventPublisher",
      "what": "事件发布适配器：实现 EventPublisherInterface",
      "traces": [],
      "needsKeyLogic": false,
      "keyLogic": null,
      "doneAt": "2026-09-07T01:43:02.804Z"
    },
    {
      "n": 23,
      "layer": "composition",